Pied billed Grebe	Part bird, part submarine, the Pied-billed Grebe is common across much of North America. These small brown birds have unusually thick bills that turn silver and black in summer. These expert divers inhabit sluggish rivers, freshwater marshes, lakes, and estuaries. They use their chunky bills to kill and eat large crustaceans along with a great variety of fish, amphibians, insects, and other invertebrates. Rarely seen in flight and often hidden amid vegetation, Pied-billed Grebes announce their presence with loud, far-reaching calls.					
Western Grebe	Setting off crisp black-and-white plumage with a yellow bill and red eye, the slender Western Grebe is an elegant presence on lakes and ocean coasts of western North America. Along with its close relative, the Clark’s Grebe, it’s renowned for a ballet-like courtship display in which male and female “run” across the water in synchrony, their long necks curved in an S-shape. These waterbirds rarely come ashore, instead taking long dives to catch fish and other aquatic animals.					
Blue Grosbeak	A large, vibrantly blue bunting with an enormous silver bill and chestnut wingbars, the male Blue Grosbeak sings a rich, warbling song from trees and roadside wires. He and his cinnamon-colored mate often raise two broods of nestlings in a single breeding season. A bird of shrubby habitats, these richly colored birds can be hard to spot unless you hear them singing first. They are widespread but not abundant across the southern U.S., and are expanding their range.					
Evening Grosbeak	A heavyset finch of northern coniferous forests, the Evening Grosbeak adds a splash of color to winter bird feeders every few years, when large flocks depart their northern breeding grounds en masse to seek food to the south. The yellow-bodied, dusky-headed male has an imposing air thanks to his massive bill and fierce eyebrow stripe. The female is more subtly marked, with golden highlights on her soft gray plumage. This declining species is becoming uncommon, particularly in the eastern United States.					
Pine Grosbeak	These plump finches dwarf every other finch in the trees and nearly every bird that lands on the feeder. The grayish bodies of Pine Grosbeaks are decked out in pinkish reds on males and yellows on females. They easily crush seeds and nip off tree buds and needles with their thick and stubby bill. They breed in open spruce, fir, and pine forests, but they drop in on feeders in winter, especially in the East when they sometimes irrupt outside of their normal range.					
Rose breasted Grosbeak	Bursting with black, white, and rose-red, male Rose-breasted Grosbeaks are like an exclamation mark at your bird feeder or in your binoculars. Females and immatures are streaked brown and white with a bold face pattern and enormous bill. Look for these birds in forest edges and woodlands. Listen, too, for their distinctive voices. They sound like American Robins, but listen for an extra sweetness, as if the bird had operatic training; they also make a sharp chink like the squeak of a sneaker.					
Pigeon Guillemot	A seabird of the northern Pacific, the Pigeon Guillemot is found along rocky coasts from Alaska to California. It spends more time close to shore than other members of the puffin family.					
California Gull	Gulls are often thought of as coastal birds, but California Gulls are also common in inland areas in the West. These medium-sized gulls breed in colonies on islands and levees in lakes and rivers. You'll also spot them in pastures, scrublands, and garbage dumps as they often forage miles from the colony, eating everything they can find from mayflies to garbage. In the winter they head to the coast where they cruise up and down the shoreline with other gulls.					
Glaucous winged Gull	The Glaucous-winged Gull is a large, pale gull of Pacific shorelines. It’s relatively easy to pick out from other gulls—most species have black wingtips, but adult Glaucous-winged Gulls have pearly gray wingtips that match the color of the rest of the back and upperwing. The only catch is that they often hybridize with Western, Glaucous, and Herring Gulls, complicating identification. These familiar birds of the Pacific Northwest coastlines forage on fish, tidepool inhabitants, and other foods along rocky shorelines, scavenge at landfills, and follow fishing vessels offshore.					
Heermann Gull	Possibly the easiest-to-identify gull in North America, Heermann’s Gulls in breeding plumage are mostly deep storm-cloud gray with a pearly white head and a brilliant red bill. Immatures are also distinctive, with dark sooty brown plumage and little streaking or mottling. These medium-sized gulls breed in Mexico's Gulf of California and then migrate northward to spend late summer and fall along the Pacific Coast. They feed mainly on anchovies and sardines, often harrying pelicans and other seabirds to steal their catches.					
Herring Gull	Spiraling above a fishing boat or squabbling at a dock or parking lot, Herring Gulls are the quintessential gray-and-white, pink-legged "seagulls." They're the most familiar gulls of the North Atlantic and can be found across much of coastal North America in winter. A variety of plumages worn in their first four years can make identification tricky'so begin by learning to recognize their beefy size and shape.					
Ivory Gull	A frequent companion of polar bears, the Ivory Gull is an all-white seabird that lives amid ice floes in the High Arctic. In this inhospitable environment, it survives by feeding on fish and invertebrates around the edges of pack ice and drift ice, as well as being a consummate scavenger, feeding on the remains of polar bear kills, seal afterbirth, and scat. Because of their dependence on sea ice, Ivory Gulls are among the most vulnerable of all species to the effects of climate change.					
Ring billed Gull	Familiar acrobats of the air, Ring-billed Gulls nimbly pluck tossed tidbits from on high. Comfortable around humans, they frequent parking lots, garbage dumps, beaches, and fields, sometimes by the hundreds. These are the gulls you're most likely to see far away from coastal areas—in fact, most Ring-billed Gulls nest in the interior of the continent, near freshwater. A black band encircling the yellow bill helps distinguish adults from other gulls—but look closely, as some other species have black or red spots on the bill.					
Slaty backed Gull	A large gull of northern coastlines; its thickset, short-winged profile distinguishes it from many similar Asian species. Adult has dark gray back and wings, intense pink legs, and an especially large white “crescent” (white tertial edges) near the wingtips when perched. Breeding adult white-headed; nonbreeding birds with variably heavy brown streaking on the head and upper breast. Juveniles dark brown and attain the adult's paler belly and gray back gradually (adult plumage attained in fourth plumage cycle). Call a deep, resonant “khaao.”					
Western Gull	A large, dark-backed gull of the Pacific Coast, the Western Gull is seldom found far from the ocean.					
Anna Hummingbird	Anna’s Hummingbirds are among the most common hummingbirds along the Pacific Coast, yet they're anything but common in appearance. With their iridescent emerald feathers and sparkling rose-pink throats, they are more like flying jewelry than birds. Though no larger than a ping-pong ball and no heavier than a nickel, Anna’s Hummingbirds make a strong impression. In their thrilling courtship displays, males climb up to 130 feet into the air and then swoop to the ground with a curious burst of noise that they produce through their tail feathers.					
Ruby throated Hummingbird	A flash of green and red, the Ruby-throated Hummingbird is eastern North America’s sole breeding hummingbird. These brilliant, tiny, precision-flying creatures glitter like jewels in the full sun, then vanish with a zip toward the next nectar source. Feeders and flower gardens are great ways to attract these birds, and some people turn their yards into buzzing clouds of hummingbirds each summer. Enjoy them while they’re around; by early fall they’re bound for Central America, with many crossing the Gulf of Mexico in a single flight.					
Rufous Hummingbird	One of the feistiest hummingbird in North America. The brilliant orange male and the green-and-orange female Rufous Hummingbird are relentless attackers at flowers and feeders, going after (if not always defeating) even the large hummingbirds of the Southwest, which can be double their weight. Rufous Hummingbirds are wide-ranging, and breed farther north than any other hummingbird. Look for them in spring in California, summer in the Pacific Northwest and Alaska, and fall in the Rocky Mountains as they make their annual circuit of the West.					
Green Violetear						
Long tailed Jaeger	The slender, almost ternlike Long-tailed Jaeger is daintier than other jaegers, but no less ferocious in its approach to getting food. These birds catch lemmings and raid bird nests during summer on the Arctic tundra. The rest of the year they pick fish from the sea surface or chase seabirds to steal their catch. They spend up to 75% of the year at sea, often on the open ocean far from land, and ranging well into the Southern Hemisphere. Immature jaegers can be extremely difficult to identify to species.					
Pomarine Jaeger	This is the biggest and burliest of the three jaeger species, which are fast, agile relatives of gulls known for harrying and stealing from other seabirds. Pomarine Jaegers are formidable predators: they survive almost entirely on lemmings in the breeding season. They spend the rest of the year on the open ocean, where they attack smaller seabirds, at times taking them for food or forcing them to give up their catch. Immature jaegers can be very difficult to identify to species.					
Blue Jay	This common, large songbird is familiar to many people, with its perky crest; blue, white, and black plumage; and noisy calls. Blue Jays are known for their intelligence and complex social systems with tight family bonds. Their fondness for acorns is credited with helping spread oak trees after the last glacial period.					
Florida Jay	The round-headed, blue and gray Florida Scrub-Jay is the only bird species that lives exclusively in Florida, where it occurs in patches of low-growing scrub oak in sandy soils. It perches tall with its long tail hanging down or boldly hops on the ground burying acorns. This social bird forms extended family groups: the young from previous years help their parents at subsequent nests until they can get a territory of their own. Extensive development and habitat fragmentation in Florida threaten this bird’s already small population, placing it on the federal endangered species list.					
Green Jay	A brilliant green, yellow, and blue jay of the tropics whose range barely stretches to southern Texas, the Green Jay is a noisy, colorful delight. The birds travel in conspicuous family flocks through brushlands and forests, seeking insects, small vertebrates, and fruit to eat. Like other jays and crows, this species is an incredibly versatile forager equally comfortable at picking, gleaning, pouncing, and even flycatching. During the breeding season, from April through June, these garrulous birds settle down and become a bit quieter.					
Dark eyed Junco	Dark-eyed Juncos are neat, even flashy little sparrows that flit about forest floors of the western mountains and Canada, then flood the rest of North America for winter. They’re easy to recognize by their crisp (though extremely variable) markings and the bright white tail feathers they habitually flash in flight. Dark-eyed Juncos are among the most abundant forest birds of North America. Look for them on woodland walks as well as in flocks at your feeders or on the ground beneath them.					
Tropical Kingbird	One of the most common sights in Middle and South America, the handsome Tropical Kingbird sits on utility lines, fences, and exposed trees seemingly everywhere. These big, gray-and-yellow flycatchers catch insects on impressive pursuit flights, usually returning to the same perch to eat their catch. In the United States, the species nests just into southernmost Texas and Arizona, where it inhabits towns, ranches, and lowlands of many sorts, especially near water. Across their vast range to the south, Tropical Kingbirds occur from sea level to areas over 10,000 feet high.					
Gray Kingbird	Pale kingbird, white below and gray above with a darker face mask. Most similar to Eastern Kingbird but Gray Kingbird has lighter gray upperparts, a longer bill, and lacks white tail tips. Primarily a Caribbean species with limited range in U.S.; found around the edge of dense woodland, especially near the coast. Also seen in more suburban areas. Often perches conspicuously on a snag, treetop, or powerline. Feeds on insects. Listen for its high-pitched twittering calls.					
Belted Kingfisher	With its top-heavy physique, energetic flight, and piercing rattle, the Belted Kingfisher seems to have an air of self-importance as it patrols up and down rivers and shorelines. It nests in burrows along earthen banks and feeds almost entirely on aquatic prey, diving to catch fish and crayfish with its heavy, straight bill. These ragged-crested birds are a powdery blue-gray; males have one blue band across the white breast, while females have a blue and a chestnut band.					
Green Kingfisher	Small kingfisher with disproportionately long bill. Dark glossy green above with white throat, collar, and spots on wings. Tail often held cocked up. White outer tail feathers spotted with green conspicuous in flight. Male has rufous breast; female breast white with spotted green double-collar. Found along rivers or ponds. Less conspicuous than some other kingfishers, often perching on overhanging branches close to water's surface. Low flight with quick wingbeats.					
Pied Kingfisher	Boldly marked black-and-white kingfisher with short, bushy crest and glossy all-dark bill. Superficially similar to Crested Kingfisher, but smaller, with much more distinctly patterned head and breast and less erect crest. Frequently seen perched in pairs or small groups. Often hovers over water when seeking prey. Inhabits a wide range of waterside habitats, from lakes to estuaries to mangroves.					
Ringed Kingfisher	Largest kingfisher in Americas with exceptionally enormous bill and raucous calls. Blue-gray with shaggy crest, white collar, and rufous belly. Male and female similar, but note different breast pattern: entirely rufous on male, while female has blue-gray band bordered by white. Often conspicuous, searching shallow water for fish from a prominent perch and chattering noisily when disturbed. Singles or pairs are also often observed flying high overhead and giving loud "keck" calls. Nests in burrows excavated in banks, generally along watercourses.					
White breasted Kingfisher						
Red legged Kittiwake	Crisp small gull with very limited range; breeds on rocky cliffs on islands in the Bering Sea, from Alaska to Russia; winters on open ocean. Size and plumage most similar to Black-legged Kittiwake, but back is darker gray, yellow bill is shorter, legs are shorter and bright red, and underwing is darker gray. Nonbreeding birds have a dark smudge around eye and a thin gray ear patch. Young birds are similar to nonbreeding adults but with black bill, duller legs, and more contrasting wing pattern.					
Horned Lark	Look carefully at a bare, brown field, especially in winter, and you may be surprised to see it crawling with little brown shapes. When they turn, you may see a neat yellow face, black mask, and tiny black 'horns' waving in the breeze. Horned Larks are widespread songbirds of fields, deserts, and tundra, where they forage for seeds and insects, and sing a high, tinkling song. Though they are still common, they have undergone a sharp decline in the last half-century.					
Pacific Loon	Breeding Pacific Loons are dapper birds with soft gray heads and intricate black-and-white patterning on the back and neck. They nest on tundra lakes, where their far-carrying wails lend a haunting sound to the Arctic landscape. This is the most abundant of North America’s five loon species, and in winter they gather in large numbers in coastal waters, bays, and estuaries. Spring migration can produce one of the continent’s great wildlife spectacles, in which thousands of Pacific Loons, along with Red-throated and Common Loons, pass by for hours.					
Mallard	If someone at a park is feeding bread to ducks, chances are there are Mallards in the fray. Perhaps the most familiar of all ducks, Mallards occur throughout North America and Eurasia in ponds and parks as well as wilder wetlands and estuaries. The male's gleaming green head, gray flanks, and black tail-curl arguably make it the most easily identified duck. Mallards have long been hunted for the table, and almost all domestic ducks come from this species.					
Western Meadowlark	The buoyant, flutelike melody of the Western Meadowlark ringing out across a field can brighten anyone's day. Meadowlarks are often more easily heard than seen, unless you spot a male singing from a fence post. This colorful member of the blackbird family flashes a vibrant yellow breast crossed by a distinctive, black, V-shaped band. Look and listen for these stout ground feeders in grasslands, meadows, pastures, and along marsh edges throughout the West and Midwest, where flocks strut and feed on seeds and insects.					
Hooded Merganser	Hooded' is something of an understatement for this extravagantly crested little duck. Adult males are a sight to behold, with sharp black-and-white patterns set off by chestnut flanks. Females get their own distinctive elegance from their cinnamon crest. Hooded Mergansers are fairly common on small ponds and rivers, where they dive for fish, crayfish, and other food, seizing it in their thin, serrated bills. They nest in tree cavities; the ducklings depart with a bold leap to the forest floor when only one day old.					
Red breasted Merganser	The Red-breasted Merganser is a shaggy-headed diving duck also known as the "sawbill"; named for its thin bill with tiny serrations on it that it uses to keep hold of slippery fish. It breeds in the boreal forest on freshwater and saltwater wetlands. Males are decked out with a dark green shaggy head, a red bill and eye, and a rusty chest. Females lack the male's bright colors but also don the same messy do. It parades around coastal waters and large inland lakes in the United States and Mexico in the winter.					
Mockingbird	If you’ve been hearing an endless string of 10 or 15 different birds singing outside your house, you might have a Northern Mockingbird in your yard. These slender-bodied gray birds apparently pour all their color into their personalities. They sing almost endlessly, even sometimes at night, and they flagrantly harass birds that intrude on their territories, flying slowly around them or prancing toward them, legs extended, flaunting their bright white wing patches.					
Nighthawk	On warm summer evenings, Common Nighthawks roam the skies over treetops, grasslands, and cities. Their sharp, electric peent call is often the first clue they’re overhead. In the dim half-light, these long-winged birds fly in graceful loops, flashing white patches out past the bend of each wing as they chase insects. These fairly common but declining birds make no nest. Their young are so well camouflaged that they’re hard to find, and even the adults seem to vanish as soon as they land.					
Clark Nutcracker	High in the mountains of the West, gray-and-black Clark’s Nutcrackers swoop among wizened pine trees, flashing white in the tail and wing. They use their dagger-like bills to rip into pine cones and pull out large seeds, which they stash in a pouch under their tongue and then carry away to bury for the winter. Each birds buries tens of thousands of seeds each summer and remembers the locations of most of them. Seeds they don’t retrieve play a crucial role in growing new pine forests.					
White breasted Nuthatch	A common feeder bird with clean black, gray, and white markings, White-breasted Nuthatches are active, agile little birds with an appetite for insects and large, meaty seeds. They get their common name from their habit of jamming large nuts and acorns into tree bark, then whacking them with their sharp bill to “hatch” out the seed from the inside. White-breasted Nuthatches may be small but their voices are loud, and often their insistent nasal yammering will lead you right to them.					
Baltimore Oriole	The rich, whistling song of the Baltimore Oriole, echoing from treetops near homes and parks, is a sweet herald of spring in eastern North America. Look way up to find these singers: the male's brilliant orange plumage blazes from high branches like a torch. Nearby, you might spot the female weaving her remarkable hanging nest from slender fibers. Fond of fruit and nectar as well as insects, Baltimore Orioles are easily lured to backyard feeders.					
Hooded Oriole	Black and brilliant yellow-orange flash across the sky when male Hooded Orioles dash through open woodlands and yards of the southwestern U.S. Following close behind are the pale yellow females. Sometimes called "palm-leaf orioles," these orioles "sew" their hanging nests onto the undersides of palm fronds. They often stay hidden while foraging, but their large, slender shape and nearly constant chatter usually give them away. Hooded Orioles also use hummingbird feeders, awkwardly bending or hanging upside down to drink.					
Orchard Oriole	The Orchard Oriole swaps the typical flame-orange of other orioles for a deep, burnished russet. Hopping among riverine shrubs or scattered trees, male Orchard Orioles sing a whistled, chattering song to attract yellow-green females. The smallest of North America's orioles, it gleans insects from foliage and builds hanging, pouchlike nests during its brief breeding season, and then heads back to Central America for the rest of the year. Orchard Orioles also feed on fruit and nectar in orchards, gardens, and elsewhere.					
Scott Oriole	In the arid Southwest, few birds stand out as brightly as the male Scott’s Oriole, which lights up the desert's earth tones with rich lemon-and-black plumage. This gifted and frequent singer inhabits high deserts and the mountain slopes adjacent to them, where it nests and forages in tall yuccas, palms, junipers, and pinyon pines, restlessly moving about in pairs or small groups in search of invertebrates, nectar, and fruit. It’s particularly closely associated with yuccas, where it forages for insects and nectar and gathers fibers for its nests.					
Ovenbird	The Ovenbird's rapid-fire teacher-teacher-teacher song rings out in summer hardwood forests from the Mid-Atlantic states to northeastern British Columbia. It's so loud that it may come as a surprise to find this inconspicuous warbler strutting like a tiny chicken across the dim forest floor. Its olive-brown back and spotted breast are excellent disguise as it gleans invertebrates from the leaf litter. Its nest, a leaf-covered dome resembling an old-fashioned outdoor oven, gives the Ovenbird its name.					
Brown Pelican	The Brown Pelican is a comically elegant bird with an oversized bill, sinuous neck, and big, dark body. Squadrons glide above the surf along southern and western coasts, rising and falling in a graceful echo of the waves. They feed by plunge-diving from high up, using the force of impact to stun small fish before scooping them up. They are fairly common today'an excellent example of a species' recovery from pesticide pollution that once placed them at the brink of extinction.					
White Pelican	One of the largest North American birds, the American White Pelican is majestic in the air. The birds soar with incredible steadiness on broad, white-and-black wings. Their large heads and huge, heavy bills give them a prehistoric look. On the water they dip their pouched bills to scoop up fish, or tip-up like an oversized dabbling duck. Sometimes, groups of pelicans work together to herd fish into the shallows for easy feeding. Look for them on inland lakes in summer and near coastlines in winter.					
Western Wood Pewee	Open woodlands throughout the West come alive when Western Wood-Pewees return for the summer. These grayish brown flycatchers use exposed branches as their stage; they put on quite a good show, sallying back and forth while nabbing flying insects with stunning precision. They sit tall when perched, showing off their partially buttoned gray vest while singing a burry and nasal version of their name all summer long. They look nearly identical to their eastern cousin, the Eastern Wood-Pewee, but they sing a burrier song.					
Sayornis	Small, sooty black flycatcher with clean white belly. Sits in the open on low perches to scan for insects, while pumping its tail up and down. Often near a water source whether it's a river, suburban creek, or salt-sprayed rocks and cliffs.					
American Pipit	American Pipits are among the very few species of American songbirds that nest in both Arctic tundra and alpine meadows. Although they’re found in the open and are not especially shy, these small birds can still be inconspicuous as they walk briskly through tundra or agricultural fields. They also forage along river and lake shores, much in the manner of a shorebird. If you don’t live in the Arctic or above treeline, look for these birds in winter.					
